{
 "snapshot_id": "snp_fi_bike_sharing_20261010",
 "source_id": "src_fi_bike_sharing",
 "retrieved_at": "2026-10-10T18:03:48Z",
 "bytes": 7029,
 "sha256": "7cf32cc6b0b0b9925cf4292f3c077267ba794affe3dcae101c0674ca68878ff6",
 "local_path": "data/raw/fi_bike_sharing/20261010/bike_sharing.zip",
 "status": "ok",
 "stored": false,
 "url": "https://data.comune.fi.it/datastore/download.php?id=6558&type=99&format=url&file_format=shp&file_id=20337",
 "media_type": "application/zip",
 "content_period": {
  "note": "scheda aggiornata il 2026-09-19: stato alla data di scarico"
 },
 "license_state": "clear"
}