{
 "snapshot_id": "snp_sit_civici_20261001",
 "source_id": "src_sit_civici",
 "retrieved_at": "2026-10-01T15:39:30Z",
 "bytes": 7273823,
 "sha256": "b1acea5703362bc497b8df8afe374ef6864cbd8ad470dd976973fd1be43af915",
 "local_path": "data/raw/sit_civici/20261001/",
 "status": "ok",
 "stored": false,
 "url": "https://sit.comune.pisa.it/arcgis/rest/services/Hosted/Civici_puntuali_View/FeatureServer/0/query?where=1%3D1&geometry=10.384496031494045,43.69925173047817,10.411508848378325,43.71724722851131&inSR=4326&outSR=3857&f=geojson",
 "media_type": "application/geo+json",
 "license_state": "unproven",
 "content_period": {
  "note": "stato del servizio alla data di scarico (data di modifica solo se dichiarata nel layer)"
 }
}